Product,Price
Best store Paw patrol tower set toys,450.00
Best store Kitchen Sink Pretend Play Kiddie Toys,105.00
Best store 36pcs plastic kitchen cooking toy cooking toy set baby,270.00
Kids Spiderman Ironman Batman Launcher Gloves Children Action Figure Toys Boys,108.00
6-layer Rainbow Tower Educational toy for baby&kids,115.00
Ulifeshop Antistress Toys Bubble Popping Game Push Fidget Sensory Toy Funny Adult Kids ReliverStress,17.00
2 pcs. Cockroaches - Ipis Prank Toy,6.00
car boy dump truck four-wheel drive off-road off-road vehicle toy inertial anti-fall baby climbing,49.00
BCW Popit Pop It siopao fidge toy Push Bubble Fidget Sensory Toy Stress Reliever Help Relieve Stress,20.00
City Diecast Ambulance Emergency Toy Car Model Open Door Ambulancia Oyuncak Educational Kids Toys,99.00
Crocodile Mouth Dentist Bite Finger Game Joke Funny Trick Toy Antistress Gift Kids Child Family,57.00
Foxmind Pop Bubble Sensory Fidget Pop It Toy Mainan Kanak Kanak Autism Stress Relief Anti Anxie,35.00
54 Pcs Wooden Wiss Toy Building Blocks Jenga,85.00
kidtoys】3D Glow in Dark Walking Rainbow Spring Toy Circle Slinky Magic Circle Stretchy,52.00
Push Pop Pop Bubble Sensory Fidget Pop It Toy Autism Stress Relief Anti Anxiety Silent Classroo,38.00
Feitian Fairy Big Hand Push Frisbee Children Outdoor Toys Classic Nostalgic Bamboo Dragonfly Frisbee,9.00
Pop Fidget Toy Push Bubble Stress Relief Kids Simple Dimple Reliever Helps Relieve Unicorn Dinosaur,41.00
"Jurassic Park Dinosaur T-rex,Tyrannosaurus,triceratops,Allosaurus,Dilophosaurus Stegosaurus,Kid",69.00
Funny Anti Stress Reliever Grape Ball Autism Mood SqueezeToy Pop its Squishy Mesh Ball Stress Hand Fidget Toy For Kids/Adults Stress,37.00
"✨SHIP FAST! Reversible octopus reversible,Child Toy TIKTOK TeeTurtle Valentine Gift Soft Flip Octopus Stuffed Plush Doll So ft Simulation Reversible Plush Toy Color Chapter Plush Doll Filled Plush Double-sided Color Flip",60.00
20 model Brachiosaurus plesiosaur Tyrannosaurus Rex Dinosaur Collection Animal model toy collection,36.00
HYG Dentist Toy Pretend Dentist Check Tooth Model Set Kit Educational Role-Playing Simulation Children Learning Toy Children Doctor,73.00
Beware Of The Evil Dog Large Board Game Parent-child Tricky Toy Bite Your Hand Evil Dog Spoof Childr,349.00
Spence School Bus Friction Powered Toy RIC GRP-78 Raion Construction and Rescue Vehicles for Boys,150.00
17cm Yellow Screaming Rubber Chicken Toy Pressure Relief Squeak Squeaker,39.00
Minions Wave 1 & 2 McDonalds Happy Meal Toys: The Rise of the Gru,60.00
Excavator Backhoe Digger Grabber Ride On Toy Car For Kids COD,699.00
Ten_Soft Pet Star Cloud Funny Chew Play Squeaker Squeaky Cute Plush Sound Toy,35.00
J king #AI Touch Talking Tom Cat Record Sounds Kids Toy Gift Ideas,300.00
LUCKY LITTLE DOCTOR SET BAG/MANUAL MIND GAME 3IN1 PURPOSE GOOD PRODUCT,350.00
Monster Truck Inertia SUV Friction Power Vehicles Toy Cars,42.00
little toy backpack set transforms to carry/ manual mind game,380.00
ILH panda bear stuff toys,399.00
✵♟Genuine Longitudinal Extra Large Universal Edition Long Box Monopoly Monopoly Chess Toys 2-8 Memor,400.00
Dog Toys Bouncy Glitter Ball Flashing LED Light Sound Bouncy Ball Funny Kids Pet Cat Toy Perros Chien Dla Psa Mascotas Accesorios For Chihuahua Puppy Cachorro,65.00
1:24 Remote control excavator toy Engineering Car Dump Metal Truck plastic Excavator For kids,476.00
Children's toy storage racks baby bookshelves multi-layer kindergarten classification shelf 4 layers,"2,194.00"
D11 Baby Bath Toy Baby Swimming Toys Cute Animals Shape Baby Accompany Bathing Toy Baby Bath Toys,35.00
Remote control helicopter USB rechargeable Aircraft Infrared Induction Toys For Children Outdoor Toy,320.00
Kids Children Alphabet Digital Puzzle Wooden Toys Kid Number Letter Matching Jigsaw Board 20*20cm,79.00
"Miigu High Quality Supermarket Toy Set w/ Cashier Table, Pushcarts & Food Pretend Play For Kids Toy","2,070.00"
Toy Aircraft Music Story Simulation Track Inertia Children'S Toy Aircraft Large Size Passenger Plane,749.00
Electric Automatic Gatling Bubble Gun for Children Outdoor Toys,125.00
Beach toys giveaways small size 12cm,15.00
Miigu Baby 3-in-1 Children's Scooter Balance Bike Adjustable Chair Tricycle Bike GB-003,"1,230.00"
CODSpot】Plating Avengers Iron Man Hulk laruang modelo toys Ultraman Figurine Avangers toy toy,340.00
Dog Chew Toys Puppy Teething Toys dog supplies,44.00
Realistic Kitchen Sink Play Set with Running Water with 20 Pieces Role Play Dishwasher Toys,289.00
Miigu Baby Folding Play Mats Educational Mats Double Sided Design 200*180 cm & 180*150*1 cm Sizes,650.00
River Stones Round Colorful Balancing Steps - Set of 5 - Gross Motor Activity - Toys for Children,"1,500.00"
20 Styles Undertale Plush Toy Doll Undertale Sans Papyrus Frisk Chara Temmie Stuffed Toys for Children Kids Gifts,150.00
XIPIN Off-Road Pull Back Vehicle Four-Wheel Stunt Rotatable Car Anti-collision Juguetes Model Car,45.00
King Dancing Hulk Light Music Electric Toys,199.00
ED shop 3D Educational learnning Wooden board Alphabet Digital Puzzle Toys Kids Matching Jigsaw toy,120.00
"Air combat catapult aircraft gun, EVA foamed child safety toy aircraft gun,toy plane",248.00
Children's alloy scene toys fire engineering headquarters series toys,655.00
KAP.CAT NO.607013 BUILDING BLOCKS TOYS,188.00
J King Magic Bubble Stick ToyS 38013B,30.00
MY111-Music Gyro Cartoon Flash Electric Baby Kids Gift children Pop Toys,120.00
L3-Multifunctional Musical Toys Toddler Baby Box Music Piano Activity Cube Geometric Blocks Sorting,499.00
✨Yinuo✨1000pc Puzzles Toys Set Adult Children World Map Education Puzzles Toys,400.00
"[Ready stock&COD]City Police SWAT Truck Building Blocks , Lego Army, Lego blocks toys for kids",800.00
Miigu Baby Mini Pizza Shop w/ Juice Machine Pretend Toys for Kids PCS35,880.00
Cars Disney Pixar Cars 3 Mater Huston Jackson Storm 1:55 Diecast Alloy Boys Kids Toys Gift,199.00
✨Yinuo✨Children's Indoor Tent Game Play House Toys Baby Home Play Garage Kits Do Dolls Ornament Early Teaching Toys Children Boy&Girl,"1,215.00"
"[Ready stock&COD]Kids home kitchen toy set ,simulation boys and girls mini home kitchen toys.",210.00
54 Pcs Wooden Toy Building Blocks Jenga Children's Early Education Educational Toys Table Games,88.00
24 grid children's educational beaded toys diy children's beaded toys brain game,200.00
2pcs. Creepy Centipede/ Alupihan Prank toy,6.00
Flipo Flip Desk Toy Kinetic Skill Toys Dancing Spinning Kit CNC Precess Zinc Alloy Material,140.00
Crystal LED Toy Fidget Spinner Finger Gyro Mainan Anak Adult Shine,79.00
Beyblade Rapidity Fight 4D Burst Character Toy God Valkyrie.6V.Rb B-73,85.00
LUOEM High Simulation Python Model Toy Big Realistic Snake Halloween Tricky Creepy Prank Scary Snak,179.00
J King #Dancing Bumblebee Light Music Electric Toys,199.00
JA Eye Popping Squeezing Fidget Toys Cool Stuff Prank Gadgets for Stress Relief,115.00
"Megaminx Stickerless ,Speed Cube 3x3 Dodecahedron Puzzle Cube Twist Travel Toys for Gift",149.00
168 Pets in 1 Virtual Cyber Nostalgic Pet Toy Tiny Game game,71.00
[In stock] New Magic Fidget Cube Infinite Cubes Sensory Stress Relief Decompression Cube Vinyl Desk Toy Macaron Toys Fidget Toy,80.00
【COD】Relieve Stress DIY Fidget String Tangle Toy Relax Anxiety Stress Adhd Sensory Aid Twist Fiddle,43.00
COD DVX #T0361 Plastic Pocket Chessboard Kids Toys Mind Game Folding Mini Chess Board Laruan,13.00
⚡ COD ⚡1:12 4WD RC Cars Remote Control Car Toys Buggy High speed Trucks Off-Road Toy for Children,889.00
1:12 Scale MN Model RTR Version WPL RC Car 2.4G 4WD MN99S MN99-S RC Rock Crawler D90 Defender Pickup Remote Control Truck,"2,800.00"
Luminous LED light Fidget Spinner Hand Top Spinners Glow in Dark Light EDC Figet Spiner Finger Stress Relief Toys,85.00
☆Wltoys XK S929-A RC Helicopter Alloy Body 2.4G 3.5CH w/ Light RC Toys for Beginner Kids Children Gi,991.00
Montessori Wooden Puzzles Hand Grab Boards Tangram Jigsaw Baby Educational Toys Cartoon 3D Puzzles,75.00
FUNandSMART 2-in-1 Pounding Toy and Shape Sorter,399.00
MGSS PH Ball Run Track Game Toy Wooden DIY Mini Tree Baby Kids Educational toy toys,75.00
Infant Remote Control Toy Early Education Simulated Cartoon Radish Music Mobile Telephone Story Toy,87.00
3d three-dimensional puzzle early childhood education puzzle decompression toy wooden puzzle,39.00
Children's phone toy,55.00
Baby Infant Toddler Concert Drum Set Children Education Toy,95.00
Racing Rail Car Model Educational Toys Children Track Car Adventure Game Brain Game Mechanical Inter,570.00
Bananagrams Word Game Puzzle Kids Party Fun Toy Case Activity Letter Pouch Bananagrams Crossword Game Alphabet Educational,220.00
Lem Mini Ball Claw Manual Candy Grabber Machine Children Interactive Educational Toy,127.00
Pops It Fidget Toys Luminous Rainbow Ball Puzzle Toy Anti Stress Simple Dimple Educational Toy,70.00
Lille Alphabet Nesting and Stacking Blocks toy montessori waldorf preschool learn puzzle build,499.00
Multi-functional Toddler Baby Music Hexahedron Geometric Blocks Educational Initiation Toy for Baby,590.00
Lem 9Pcs/Set Kids Educational Dental Scene Toys Preschool Teaching Brushing Game,96.00
Baby Education Insect Hand Knock on Piano Toy 5-Note Xylophone Musical,56.00
Wooden hammering Toy Ball Hammer Toy Wooden pounding Toy Toddlers Color Mat,158.00
Kid Scientist Series DIY Make Your Own Slime Play Kit Experiment (2 vials) Toy,179.00