Lazada,Lazada Price,Shopee,Shopee Price,Cosine Similarity,Price Difference
"Socone Infant 100% Cotton 25x25cm (2pcs) Baby Face Towel Pure Soft Muslin Gauze Towel, Saliva towel, Bath towel Bibs 4565",78.0,NO SIMILAR PRODUCT FOUND,0.0,0.0,N/A
Kangaroomom Hooded Baby Kids Bath Towel Bathrobe Style Bath Towel Blanket for 0-6 years Old,123.75,3pcs in 1 pack Bath Scrub Set Bath Ball Bath Mittens Bath Towel Body Scrubber in Brown bear Pouch,79.0,0.41666666666666663,44.75
Microfiber Drying Cap After Shower Bath Towel Cap with Bow Spa Bath Accessories for Women,30.0,Bath and Shower Cap (Thick),30.0,0.512989176042577,0.0
"Bath Towel 1pcs 70x140 cm cotton
",75.0,NO SIMILAR PRODUCT FOUND,0.0,0.0,N/A
"Celina Home Textiles Random Color Creative Clothes Hanger 9 Hole Towel Hook Closet Organizer AS658
",9.0,NO SIMILAR PRODUCT FOUND,0.0,0.0,N/A
Bath Scrubbers Mesh Net Scrub Bath Ball Bath Shower Sponge Small 30g,20.0,Bath Scrubbers Mesh Net Ball Bath Shower Sponge,9.0,0.8944271909999159,11.0
Set of 4 Baby Back Towel Sweat Absorber (random designs),99.0,NO SIMILAR PRODUCT FOUND,0.0,0.0,N/A
COD☑️Microsoft Towel Bath Robes Magic Bath Towel More Color,54.0,3pcs in 1 pack Bath Scrub Set Bath Ball Bath Mittens Bath Towel Body Scrubber in Brown bear Pouch,79.0,0.472455591261534,-25.0
Baby Cotton Bath Towel with Hood 100% Organic Cotton Baby Hooded Bath Towel 75x75cm Swaddle Receiving Blanket for Newborn Baby Blanket,399.0,Johnson's Baby Bath 1000ml,85.0,0.4225771273642583,314.0
Bathrobe Thick Cotton Towel Soft and Absorbent Bath Robe for Adults Freesize up to XL,280.0,NO SIMILAR PRODUCT FOUND,0.0,0.0,N/A
SOBY PH Kids Towel with Hood Baby Children Beach Hooded Towel Children Baby Bath Towel Blanket,250.0,NO SIMILAR PRODUCT FOUND,0.0,0.0,N/A
Primo+Skin Hydro Glow Body Soap w/ Niacinamide 135g,95.0,NO SIMILAR PRODUCT FOUND,0.0,0.0,N/A
Dr. Sensitive Activated Charcoal Whitening Soap 120g,80.0,NO SIMILAR PRODUCT FOUND,0.0,0.0,N/A
Aliver Exfoliating shower gel 350ml Full body whitening and brightening skin Exfoliating dead skin smooth skin care Whitening Body Wash Moisturizing Hydrate Remove Dry Skin Refreshing Lasting Fragrance Beautiful Skin Removes Oil Beauty,265.0,NO SIMILAR PRODUCT FOUND,0.0,0.0,N/A
"ThaiLab Creations Acne Lemon Soap, Lemon Fruit Extract ,Vitamin C, Vitamin B3, Niacinamide, Antioxidant, Calming, Prevents future breakouts, Oil Control, Acne Treatment, Unclogs Pores, Pimple Fighting, Sensitive Skin, Oily Skin, Acne Prone, Bar Soap, 90g",59.0,NO SIMILAR PRODUCT FOUND,0.0,0.0,N/A
Messy Bessy Hand & Body Wash Ocean Rain 540ml,275.0,NO SIMILAR PRODUCT FOUND,0.0,0.0,N/A
Irish Spring Original Body Soap 3.7oz x 6,294.0,Irish Spring Bath Soap.,130.0,0.6123724356957946,164.0
"SNAILWHITE Glass Skin Glow Trio [Brightening Gift Set, Exclusive Online Promo Bundle]",1399.0,NO SIMILAR PRODUCT FOUND,0.0,0.0,N/A
Quick Delivery] The Ordinary 5% caffeine + EGCG eye serum is the best eye cream for men and women to eliminate wrinkles and dark circles,150.0,NO SIMILAR PRODUCT FOUND,0.0,0.0,N/A
Johnson's Active Kids Strong & Healthy Shampoo 200ml + FREE 100ml,173.0,NO SIMILAR PRODUCT FOUND,0.0,0.0,N/A
100% Hotel Bath Linen Jacquard Embossed Bath Foot Towel (50cm*80cm) 295G,140.0,3pcs in 1 pack Bath Scrub Set Bath Ball Bath Mittens Bath Towel Body Scrubber in Brown bear Pouch,79.0,0.4252100321353806,61.0
"New EIDERFINCH ABM-015 Memory Foam Bathroom Mat Absorbent Soft Comfort Non slip Bath Mat
",69.0,NO SIMILAR PRODUCT FOUND,0.0,0.0,N/A
ARUN Floor Mat Non-Slip Bath Mat Mesh Drainage Mat Square PVC Water Proof Cushion Bathroom DIY Toilet Decor,20.79,NO SIMILAR PRODUCT FOUND,0.0,0.0,N/A
[SALE] Microfiber Mat Anti-Slip Door Mat Bath Floor Mat Non-slip Doormat Rug for Bathroom Toilet CR - Wow Supermall Sulit Deals,99.0,NO SIMILAR PRODUCT FOUND,0.0,0.0,N/A
Tiny Buds Natural Rice Baby Bath,185.0,Tiny Buds Natural Rice Baby Bath,185.0,1.0000000000000002,0.0
【Ready stock】Ladies Christmas Set Gift Coconut Shower Gel Pack 2 x 16.4 oz,450.0,NO SIMILAR PRODUCT FOUND,0.0,0.0,N/A
IRISH SPRING 5in1 body wash and shampoo 532ml,349.0,NO SIMILAR PRODUCT FOUND,0.0,0.0,N/A
STYLECLUB ALOE GROW HAIR GROWER SHAMPOO 300ml,55.0,NO SIMILAR PRODUCT FOUND,0.0,0.0,N/A
"Silka Premium Whitening body wash 100ml ,200ml ,300ml",85.0,PUREYES Foaming Whitening Shower Body Wash,180.0,0.4330127018922194,-95.0
Vaseline Healthy Bright Gluta-Hya Serum Lotion Dewy Radiance 330mL,409.0,NO SIMILAR PRODUCT FOUND,0.0,0.0,N/A
Wall Mounted Hand Soap Shampoo Dispenser,82.17,NO SIMILAR PRODUCT FOUND,0.0,0.0,N/A
Soap Pump Dispenser,35.0,NO SIMILAR PRODUCT FOUND,0.0,0.0,N/A
Automatic Dustproof Toothpaste Dispenser with Toothbrush Holder,59.0,NO SIMILAR PRODUCT FOUND,0.0,0.0,N/A
I&UMicrofiber character bath towel 70X140cm 19Design,79.0,NO SIMILAR PRODUCT FOUND,0.0,0.0,N/A
Original BATH - BODY WORKS Shower Gel 295mL US Brand,581.0,[Original] Bath & Body Works SHOWER GEL 295ml,450.0,0.8819171036881966,131.0
"Body & Earth 6 in 1 Bath and Body Gift Set - Luxurious 6 Pcs Bath Kit for Women, Spa Set with Lavender Scent - Bubble Bath, Shower Gel, Hand & Face Cream, Body Lotion, Perfect Gift Box for Women",599.0,"Lavender 6 in 1 Bath and Body Gift Set(Bubble Bath, Shower Gel, Hand & Face Cream, Body Lotion)",583.0,0.7985836518841368,16.0
Kevin 1 pcs Soap Mesh Foaming Net Bubble Mesh Bag Skin Clean Tool,122.0,Kevin 1 pcs Soap Mesh Foaming Net Bubble Mesh Bag Skin Clean Tool,5.0,1.0,117.0
3pcs Body Scrubber Rubbing Brushes for Body Back Bath Shower ball Scrubbing gloves,80.0,Shower Scrubber Loofah Sponge Bath Body Back Brush,15.0,0.547722557505166,65.0
Bath Shower Sponge Shower Body Wash Scrubber Cleaning Scrubs Bathing Ball Exfoliator Soap Mesh,76.0,Bath Scrubbers Mesh Net Ball Bath Shower Sponge,9.0,0.5533985905294664,67.0
Nest Shower bath gloves exfoliating wash skin mitt massage loofah body scrubber,85.0,JH 1pc Shower Gloves Exfoliating Wash Skin Spa Bath Gloves Foam Bath Skid Resist COD,9.0,0.5298129428260175,76.0
❈☞☌ RAPLUS Bathroom Flower Mesh Bath Washing Body Wisp Ball Body Wash B010,214.0,RAPLUS Bathroom Flower Mesh Bath Washing Body Wisp Ball Body Wash B010,38.0,0.9999999999999999,176.0
Happy Bath Body Wash Natural/Essence/Perfume/Forever 900g Korean Product Korean Body Wash,260.0,Happy Bath Body Wash Natural/Essence/Perfume/Forever 900g Korean Product Korean Body Wash,260.0,1.0,0.0
Images Fruit Extract Bath Scrub Perfume Body Wash SPA Shower Exfoliate Cream Men Women 300ml,326.0,Images Fruit Extract Bath Scrub Perfume Body Wash SPA Shower Exfoliate Cream Men Women 300ml,62.0,0.9999999999999998,264.0
[Radiance Routine - Nourish Set] Cetaphil Brightness Reveal Body Wash - 245ml + Brightening Lotion - 245ml,1639.0,NO SIMILAR PRODUCT FOUND,0.0,0.0,N/A
【[Suport Cash On Delivery]】 New Wash Face Soap Foaming Net Bath Shower Soap Blister Bubble Mesh Body sing Nets Bath Washing Tool Bathroom Accessories,172.0,New Wash Face Soap Foaming Net Bath Shower Soap Blister Bubble Mesh Body Cleansing Nets Bath Washing Tool Bathroom,9.0,0.8669214468630106,163.0
"Human Heart Nature 120g Kids Bath Soap in Chocolate Adventure, Kid's Care, , 120g",82.0,Human Nature Kids Bath Soap 120g,74.0,0.7378647873726218,8.0
PHANT Stress Relief Natural Relax Stress Bath Salt Ball Body Skin Whiten Bubble Shower Bath Ball Shower Bombs Bath Bombs Body Essential Oil,88.0,Bathtub Bath Salt Ball Body Skin Whiten Relax Stress Relief Bubble Shower Bombs,25.0,0.8438196242002223,63.0
HAPPY BATH Pure White Magnolia Essence Body Wash SAMPLE 5g,352.0,HAPPY BATH Pure White Magnolia Essence Body Wash SAMPLE 5g,8.0,0.9999999999999999,344.0
Seoul White Korea BUBBLE BATH Whip It! Whip Soap - 3x60g Double White Soap Set FREE Scrunchie softsoap body wash reviews,495.0,Seoul White Korea BUBBLE BATH Whip It! Whip Soap + 3x60g Double White Soap Set FREE Scrunchie,287.0,0.9198662110078,208.0
㍿✉ Shower Scrubber Loofah Sponge Bath Body Back Brush Assorted Color,130.0,Shower Scrubber Loofah Sponge Bath Body Back Brush Assorted Color,13.0,0.9999999999999999,117.0
Cloud Rainbow Bubble Bath Salt Ball Body Skin Whitening Ease Moisturizing Relax Shower Bath Bomb Effectively Soften Cutin Clean Skin Care Natural Bubble Bath,350.0,Cloud Rainbow Bubble Bath Salt Ball Body Skin Whitening Ease Moisturizing Relax Shower Bath Bomb Effectively Soften Cutin Clean,113.0,0.9356014857063998,237.0
"BUYMORE PH 2 in 1 Smooth body scrub, net soft sponges, hair bath wooden back scrub shower portable body bath scrub silky scrub sponges beauty bath personal car 2in1 Long handle Body Bath Brush with Scrub Net Body Shower loofah body scrub",127.0,2in1 Long handle Body Bath Brush with Scrub Net,40.0,0.7056503290095426,87.0
"Ryx CLEAR BOMB Advanced Exfoliating Kit (Authentic, Authorized RyxSkin Sincerity Seller) Ryx Set Ryx Face",250.0,NO SIMILAR PRODUCT FOUND,0.0,0.0,N/A
[ 10X WHITENING BLEACHING LOTION ] Greenika SPF15 Bleaching Lotion Glutathione Whitening Lotion Lightens Skin Pigmentations Scars and Blemishes Erases Sun Spots Dark Spots and Acne Scars Effective Whitening Soap for Dark Spot Remover Skin Whitening Lotion,149.0,NO SIMILAR PRODUCT FOUND,0.0,0.0,N/A
Leaf Shape Soap Cleaning Sponge Holder Drain Box Soap Drying Stand Rack with Suction Cups,26.0,NO SIMILAR PRODUCT FOUND,0.0,0.0,N/A
Images Fruit Extract Bath Scrub Perfume Body Wash SPA Shower Exfoliate Cream Men Women 300ml,326.0,Images Fruit Extract Bath Scrub Perfume Body Wash SPA Shower Exfoliate Cream Men Women 300ml,62.0,0.9999999999999998,264.0
Wall Mounted Hand Soap Shampoo Dispenser,82.17,NO SIMILAR PRODUCT FOUND,0.0,0.0,N/A
"Body & Earth 8 Pcs Bath Spa Gift Sets Lavender & Honey Scent Includes Bubble Bath Shower Gel, Body Lotion Bath Salt and More Bath Gift Basket for Home Relaxation",669.0,"Lavender & Honey Spa Bathtub Gift Set Includes Bubble Bath, Shower Gel, Body Lotion, Bath Salt More",809.0,0.7907736701585487,-140.0
♀ IAC Bath Shower Scrubber Loofah Sponge Bath Body Back Brush Body with Long Handle,177.0,Shower Scrubber Loofah Sponge Bath Body Back Brush,15.0,0.8333333333333334,162.0
Donut Shaped Bath Bombs Aromatherapy Organic,99.0,Donut Bath Bombs (Single),125.0,0.6123724356957946,-26.0
❣️BBW❣️Bath - Body Works Aromatherapy Shower Gel Body Wash Foam Bath❣️Stress Relief❣️Love❣️Sleep❣️,1076.0,Bath & Body Works Aromatherapy Foaming Body Wash,508.0,0.6882472016116852,568.0
How To Remove Body Odor [AUTHENTIC] Aromatherapy Bath and Body Works Stress Relief Eucalyptus Spearmint Body Cream Wash,818.0,"[AUTHENTIC] Aromatherapy Bath and Body Works Stress Relief Eucalyptus Spearmint Body Cream, Wash",490.0,0.8959786703810412,328.0
Dove White Beauty Bar Soap 113g,25.0,Dove Bath Soap Bar 113g (Pack of 2 and 4) Imported from USA,115.0,0.492365963917331,-90.0
Bathroom Soap Box Storage Organizer Hanging Punch-free Sticky Wall-Mounted Drain Rack Soap Box,30.69,NO SIMILAR PRODUCT FOUND,0.0,0.0,N/A
【】 Kojic Soap Natural Organic Handmade Cold Processed Bath Soap,235.0,Kojic Soap Natural Organic Handmade Cold Processed Bath Soap,69.0,1.0,166.0
(2in1) Bath & Body Works (Warm Vanilla Sugar Fine Fragrance Mist 236ml + Warm Vanilla Sugar Body Cream 226g),189.0,NO SIMILAR PRODUCT FOUND,0.0,0.0,N/A
20Pieces/Box Disposable Portable Mini Soapy Paper Washing Hand Bath Clean Travel Health Antibacterial Soap,18.0,20Pieces/Box Disposable Portable Mini Soapy Paper Washing Hand Bath Clean Travel Health Antibacterial Soap,34.0,0.9999999999999998,-16.0
Flip Soap Dish Creative Drainage Punching Free Toilet with Lid Home Bathroom Soap Box Laundry Soap Box Soap Holder,315.0,COD 100g Sea Salt Soap Natural Goat Milk in Addition to Mites Soap Acne Soap Cleansing Oil Control Soap Washing Face Bath Horse Oil,49.0,0.4518259957799241,266.0
"
Happy Bath Sun han 900g",250.0,"Happy Bath Body Wash 900g (Sun Han, Chuk chuk, Grapefruit, May Rose and Lavender)",250.0,0.5590169943749475,0.0
1pcs Shower cup bath shower reusable clear plastic hair cover,18.0,1pcs Shower cup bath shower reusable clear plastic hair cover,18.0,1.0000000000000002,0.0
6pcs Bath Bombs Bubbles Bath Salts Ball Essential Oil Handmade SPA Stress Relief Exfoliating Mint Lavender Rose Flavor,301.9,"5PCS Bath Ball, Handmade Bubble Bath Bomb Rich in Essential Oil, Baking Soda, Citric acid, Cellulose, Stress Relief Moisturizing SPA Shower",119.0,0.5128776445321727,182.89999999999998
Original BATH - BODY WORKS Aromatherapy Body Wash with Essential Oil 295mL,876.0,Original BATH & BODY WORKS Aromatherapy Body Wash with Essential Oil 295mL,520.0,0.9999999999999998,356.0
【SK】20 grams White Round Bath Soap (20 pcs 25 pcs 50 pcs),230.0,"【SK】20 grams White Round Bath Soap (20 pcs, 25 pcs ,50 pcs)",78.0,1.0000000000000002,152.0
DermaVeen Shower & Bath Oil 1 Litre,1200.0,DermaVeen Shower & Bath Oil 1 Litre,1100.0,0.9999999999999999,100.0
Showermate Goat Milk Moisturizing & Whitening Body Wash 550ml,281.06,PUREYES Foaming Whitening Shower Body Wash,180.0,0.4330127018922194,101.06
"Vicks VapoBath, Bath Crystals, Bath Bomb, Non-Medicated Bath Salts, Soothing Vicks Vapors Steam Aromatherapy with Eucalyptus and Menthol, 15 OZ Bath Salts 1 pc | Imported from USA(",1599.0,Bath Bomb Gift Set w/ Bubble Bath,460.0,0.48524747941547286,1139.0
Milea All Organics Guava Healing Bath Soap,105.0,Milea All Organics Guava Healing Bath Soap,40.0,0.9999999999999997,65.0
GIGA Aromatherapy Soap Lavender - Calming and Soothing - 50% OFF,40.0,NO SIMILAR PRODUCT FOUND,0.0,0.0,N/A
Snoe Beauty S-SKIN Naturals HIMALAYAN PINK SALT Body Soap & Scrub | water-retention,99.0,NO SIMILAR PRODUCT FOUND,0.0,0.0,N/A
"40cm Round Mirror for Bathroom, Circle Wall Mirror Mounted Round Mirror for Wall Decor, Living Room, Bedroom",649.0,NO SIMILAR PRODUCT FOUND,0.0,0.0,N/A
FS 180 x 180cm Bathroom Waterproof Non-transparent Shower Curtain Toilet Partition Moisture-Proof Curtain Toilet Occlusion Insu,37.0,NO SIMILAR PRODUCT FOUND,0.0,0.0,N/A
Bathroom Slippers Unisex Non Slip Thick Sole Slippers Summer Japanese Style,139.0,NO SIMILAR PRODUCT FOUND,0.0,0.0,N/A
AMIRA Oatmeal Milk & Honey Soap 100g,109.0,BATHE & BEAUTY | oatmeal with milk and honey,150.0,0.4629100498862757,-41.0
【】 Mango Oatmeal Soap Natural Organic Handmade Cold Processed Bar Soap - Skin and Face Bath Care,190.0,Mango Oatmeal Soap Natural Organic Handmade Cold Processed Bar Soap - Skin and Face Bath Care,42.0,1.0,148.0
❂✾ Foaming Bath Bomb Bubblegum 1pc,302.0,Foaming Bath Bomb Bubblegum 1pc,120.0,0.9999999999999999,182.0
Foot Bomb: Minty Moo (Peppermint Scent),99.0,Peppermint Bath Bomb,120.0,0.4714045207910318,-21.0
UniLove Baby Bath 300ml Bottle of 1,144.0,UniLove Baby Bath 300ml Bottle of 1,144.0,1.0000000000000002,0.0
ZC- A Bonne Spa Milk Salt whitening scrub,70.0,Original A Bonne Milk Spa Body Bath Salt Original Made In Thailand,75.0,0.4193139346887673,-5.0
"Cloud Cup Storage Or Organizer For Bathroom Toothbrush Holder, Toothpaste Holder, Pen Holder and Make Up Brush Organizer and Environmental Friendly Plastic With A Simple Cloud Design To Make Your Bathroom and Room Supplies Organize",37.62,NO SIMILAR PRODUCT FOUND,0.0,0.0,N/A
1 KILO BATH SALT BODY SCRUB FOR REBRANDING (SCENTED)himalayan rose matcha mint oatmeal lavender,278.0,1 KILO BATH SALT BODY SCRUB FOR REBRANDING (SCENTED)himalayan rose matcha mint oatmeal lavender,135.0,0.9999999999999999,143.0
Dr Teal's Pink Himalayan Mineral Soak with Epsom Salt & Essential Oils Restore & Replenish 3 lb,550.0,NO SIMILAR PRODUCT FOUND,0.0,0.0,N/A
Silicone Bath Shower Brush Body Scrubber Massage Brush Anne Car Accessories ( Random Color),32.67,Silicone Bath Shower Brush Body Scrubber Massage Brush Anne Car Accessories ( Random Color),33.0,0.9999999999999998,-0.3299999999999983
"Be Natural Authentic Yoko Yogurt Milk Spa Salt Scrub 100% Natural Scrub Lightening Skin, Moisturizing, Collagen, Vitamin B3, Vitamin E (Zipper Bag) 300g / 50g",29.0,YOKO Spa Milk Salt Bath With Vitamin E & B3 lightening and whitening skin (300g),39.0,0.5150262026246047,-10.0
[PROMO] Johnson's Milk+Oats Bath 500ml + FREE Lotion 200ml,274.0,Johnson's Milk+Oats Bath 500ml + FREE Lotion 200ml,274.0,0.9428090415820634,0.0
Tiny Buds Natural Rice Baby Bath,185.0,Tiny Buds Natural Rice Baby Bath,185.0,1.0000000000000002,0.0
[PROMO] Johnson's Cotton Touch Wash 200ml + FREE Messy Times Wipes 20s,204.0,NO SIMILAR PRODUCT FOUND,0.0,0.0,N/A
AA Merchandise 2 Layer Bathroom Shower Wall Mounted Space Stainless Steel Towel Storage Hanger Shelf Holder Stand Rack with Hooks Bathroom Accessories Organizer,265.0,NO SIMILAR PRODUCT FOUND,0.0,0.0,N/A
"No.1 Top Selling BMRS Fresh All Day EMPEROR INTIMATE WASH 150ml (For Men) Masculine Wash, Feminine Wash, Men Personal Care, Anti Fungal and Long Lasting Cooling Effect, Authentic Best Product Antibacterial Pinky Secret Feminine Wash Good For Women and Men",150.0,NO SIMILAR PRODUCT FOUND,0.0,0.0,N/A
Genuine Product yu qun Tube Top Pure Cotton Beauty Salon Bath Towel Bathrobes Moisture-wicking Clothing Cotton Toweling Women's,953.0,NO SIMILAR PRODUCT FOUND,0.0,0.0,N/A
LUMIN 100pcs/pack Top Selling Disposable Household Clear Travel Camping Accessories Bathroom Products Hotel Shower Bathing Cap Shower Caps Hair Salon,152.0,NO SIMILAR PRODUCT FOUND,0.0,0.0,N/A
Top Grade Hotel Hand Sanitizer Bottle European Style Soap Dispenser Creative Lotion Bottle Shampoo Shower Gel an ya ping Set,277.0,NO SIMILAR PRODUCT FOUND,0.0,0.0,N/A
